ID,본문,소제목,제목,저자,annotator01,annotator02,annotator03,annotator04
5406,불타던 태양까지가 그의 힘을 잃고,,주리라 네 탐내는 모든 것을,임화,"안타까움/실망, 불쌍함/연민, 서러움, 패배/자기혐오","불안/걱정, 안타까움/실망, 절망","놀람, 당황/난처, 부담/안_내킴, 불안/걱정, 안타까움/실망","당황/난처, 불안/걱정, 안타까움/실망, 절망"
5407,헛되이 긴 동안을 글러가던,,주리라 네 탐내는 모든 것을,임화,"어이없음, 서러움, 불안/걱정, 안타까움/실망, 불쌍함/연민, 한심함, 패배/자기혐오, 힘듦/지침","한심함, 서러움, 슬픔, 안타까움/실망, 어이없음, 힘듦/지침","부담/안_내킴, 불평/불만, 안타까움/실망","불안/걱정, 안타까움/실망, 힘듦/지침"
5408,그 끝없이 차고 흰 벌판 위에,,주리라 네 탐내는 모든 것을,임화,"불안/걱정, 비장함, 감동/감탄, 존경","절망, 지긋지긋, 힘듦/지침, 부담/안_내킴, 불안/걱정, 안타까움/실망, 서러움, 슬픔","부담/안_내킴, 안타까움/실망","깨달음, 비장함, 절망, 슬픔"
5409,일제히 생탄의 마당으로 잡아 일으킬,,주리라 네 탐내는 모든 것을,임화,"비장함, 기대감","비장함, 감동/감탄, 존경, 기대감, 불안/걱정","기대감, 기쁨","증오/혐오, 화남/분노"
5410,"이 세월의 영원한 흐름을,",,주리라 네 탐내는 모든 것을,임화,"깨달음, 감동/감탄, 비장함","감동/감탄, 기대감, 깨달음, 불안/걱정, 존경","놀람, 깨달음, 비장함","비장함, 슬픔, 감동/감탄, 깨달음"
5411,"철수의 위대한 힘을,",,주리라 네 탐내는 모든 것을,임화,"아껴주는, 감동/감탄, 존경, 기대감, 깨달음, 환영/호의, 뿌듯함","감동/감탄, 기대감, 존경, 불안/걱정, 비장함, 신기함/관심, 아껴주는, 의심/불신, 안심/신뢰","비장함, 뿌듯함","놀람, 신기함/관심, 환영/호의, 흐뭇함(귀여움/예쁨)"
5412,닥쳐오는 봄을!,,주리라 네 탐내는 모든 것을,임화,"기대감, 환영/호의, 감동/감탄, 기쁨, 즐거움/신남, 행복, 놀람, 뿌듯함, 신기함/관심","기대감, 감동/감탄, 불안/걱정, 비장함, 환영/호의","감동/감탄, 기대감, 기쁨, 신기함/관심","감동/감탄, 기쁨, 기대감, 불안/걱정, 신기함/관심"
5413,살아있는 모든 것의 원수여! 말해보라!,,주리라 네 탐내는 모든 것을,임화,"증오/혐오, 화남/분노, 비장함, 우쭐댐/무시함, 서러움","증오/혐오, 화남/분노, 비장함","비장함, 의심/불신, 증오/혐오","경악, 당황/난처, 불안/걱정, 불평/불만, 비장함, 증오/혐오, 화남/분노"
5414,막을 수 있겠는가?,,주리라 네 탐내는 모든 것을,임화,"의심/불신, 기대감, 비장함, 우쭐댐/무시함","의심/불신, 비장함, 안타까움/실망, 기대감, 우쭐댐/무시함, 한심함",우쭐댐/무시함,"비장함, 슬픔, 불안/걱정"
5415,주리라! 주검의 악령이여! 네 탐내는 모든 것을……,,주리라 네 탐내는 모든 것을,임화,"공포/무서움, 비장함, 환영/호의, 지긋지긋","서러움, 비장함, 증오/혐오, 패배/자기혐오, 안타까움/실망, 부담/안_내킴, 절망","공포/무서움, 당황/난처, 부담/안_내킴, 불안/걱정, 비장함","경악, 비장함, 화남/분노, 증오/혐오, 힘듦/지침"
5416,가을의 산야가 네 위에 살아있는 모든 것을,,주리라 네 탐내는 모든 것을,임화,"존경, 아껴주는, 신기함/관심, 안심/신뢰","고마움, 기쁨, 아껴주는, 신기함/관심, 존경, 편안/쾌적, 행복, 기대감","감동/감탄, 기대감, 기쁨",감동/감탄
5417,눈 속 깊이 내어 맡기듯……,,주리라 네 탐내는 모든 것을,임화,"불쌍함/연민, 환영/호의, 신기함/관심, 깨달음, 아껴주는","서러움, 안타까움/실망, 불안/걱정, 의심/불신, 아껴주는, 슬픔, 비장함","부담/안_내킴, 불안/걱정","절망, 힘듦/지침, 슬픔"
5418,그러나 종달새 우는 오월,,주리라 네 탐내는 모든 것을,임화,"슬픔, 비장함, 기대감, 서러움, 신기함/관심","흐뭇함(귀여움/예쁨), 행복, 불안/걱정, 비장함, 아껴주는, 신기함/관심, 즐거움/신남, 안타까움/실망, 서러움","기대감, 신기함/관심","감동/감탄, 기쁨, 즐거움/신남, 환영/호의"
5419,푸른 하늘 아래 나팔을 불며,,주리라 네 탐내는 모든 것을,임화,"감동/감탄, 기대감, 즐거움/신남, 흐뭇함(귀여움/예쁨), 환영/호의, 안심/신뢰","즐거움/신남, 환영/호의, 편안/쾌적, 행복, 기대감, 기쁨","기대감, 기쁨, 신기함/관심","감동/감탄, 기대감, 기쁨, 행복, 즐거움/신남"
5420,군호 소리 높이 두 발을 구르고,,주리라 네 탐내는 모든 것을,임화,"비장함, 신기함/관심, 공포/무서움","비장함, 불안/걱정, 감동/감탄, 기대감","놀람, 비장함","화남/분노, 증오/혐오, 비장함"
5421,"잠자는 모든 것을 일으키고,",,주리라 네 탐내는 모든 것을,임화,"기대감, 신기함/관심, 감동/감탄, 뿌듯함, 놀람, 비장함","비장함, 아껴주는, 기대감, 불쌍함/연민, 고마움, 서러움, 존경","놀람, 당황/난처, 부담/안_내킴",비장함
5422,침묵한 온갖 것의 입을 열어,,주리라 네 탐내는 모든 것을,임화,"기대감, 깨달음, 신기함/관심, 비장함","기대감, 비장함, 서러움, 슬픔, 아껴주는, 불안/걱정","기대감, 기쁨, 뿌듯함","경악, 비장함, 절망, 힘듦/지침"
5423,"절규의 들로 불러 내이며,",,주리라 네 탐내는 모든 것을,임화,"화남/분노, 서러움, 절망","화남/분노, 지긋지긋, 부담/안_내킴, 불평/불만, 증오/혐오","부담/안_내킴, 불안/걱정, 안타까움/실망, 절망","경악, 공포/무서움, 불쌍함/연민, 불안/걱정, 서러움"
5424,죽어진 그 시절의 모든 목숨을,,주리라 네 탐내는 모든 것을,임화,"비장함, 불쌍함/연민, 고마움, 서러움, 슬픔","서러움, 안타까움/실망, 절망, 비장함","불쌍함/연민, 안타까움/실망, 슬픔","불쌍함/연민, 슬픔, 절망, 힘듦/지침"
5425,"무덤으로부터 두손을 잡아 일으킬,",,주리라 네 탐내는 모든 것을,임화,"기대감, 비장함, 불안/걱정","기대감, 고마움, 비장함, 안심/신뢰, 환영/호의","놀람, 당황/난처, 역겨움/징그러움","감동/감탄, 기대감, 비장함, 존경"
5426,저 열길 얼음 속에서도 아직,,주리라 네 탐내는 모든 것을,임화,"슬픔, 서러움, 불안/걱정, 기대감, 비장함, 안심/신뢰, 불쌍함/연민","기대감, 서러움, 안타까움/실망, 불안/걱정, 환영/호의","불안/걱정, 안타까움/실망","당황/난처, 부담/안_내킴, 불안/걱정, 절망, 힘듦/지침"
5427,"산 것을 자랑하는 어린 물고기의 마음이,",,주리라 네 탐내는 모든 것을,임화,"뿌듯함, 불쌍함/연민, 아껴주는, 환영/호의, 감동/감탄, 서러움, 슬픔","흐뭇함(귀여움/예쁨), 아껴주는, 신기함/관심, 불안/걱정","기대감, 기쁨, 즐거움/신남","감동/감탄, 기쁨, 신기함/관심, 아껴주는, 행복, 흐뭇함(귀여움/예쁨), 환영/호의"
5428,한 줄기 빛깔도 엿볼 수 없는,,주리라 네 탐내는 모든 것을,임화,"절망, 안타까움/실망","절망, 서러움, 당황/난처, 패배/자기혐오, 안타까움/실망","부담/안_내킴, 불안/걱정, 안타까움/실망","불안/걱정, 슬픔, 안타까움/실망, 절망, 힘듦/지침"
5429,"이 어두운 땅속에서,",,주리라 네 탐내는 모든 것을,임화,"슬픔, 절망, 깨달음, 당황/난처, 비장함","부담/안_내킴, 불안/걱정, 불평/불만, 서러움, 슬픔, 안타까움/실망, 절망, 지긋지긋, 힘듦/지침","공포/무서움, 당황/난처, 부담/안_내킴, 불안/걱정","당황/난처, 공포/무서움, 불안/걱정, 의심/불신, 패배/자기혐오, 힘듦/지침"
5430,두 주먹을 고쳐쥐며 높이고 있는,,주리라 네 탐내는 모든 것을,임화,"비장함, 존경, 감동/감탄","감동/감탄, 기대감, 놀람, 비장함, 신기함/관심, 존경, 불안/걱정, 뿌듯함, 환영/호의","기대감, 비장함, 뿌듯함","불평/불만, 비장함, 화남/분노, 증오/혐오"
5431,‘한니발’의 굳은 맹서를……,,주리라 네 탐내는 모든 것을,임화,"비장함, 아껴주는, 기대감","비장함, 서러움, 슬픔, 불안/걱정, 기대감","비장함, 뿌듯함","화남/분노, 증오/혐오, 비장함"
5432,암흑이여! 주검의 어머니인 대지여!,,주리라 네 탐내는 모든 것을,임화,"비장함, 존경, 공포/무서움, 불안/걱정, 힘듦/지침, 기대감, 화남/분노, 깨달음","감동/감탄, 불안/걱정, 화남/분노, 서러움, 비장함, 슬픔, 힘듦/지침, 존경, 공포/무서움, 절망","공포/무서움, 놀람, 부담/안_내킴, 불안/걱정, 신기함/관심","경악, 놀람, 불안/걱정, 절망, 서러움, 힘듦/지침"
5433,말해보라! 꽉 그 목을 눌러,,주리라 네 탐내는 모든 것을,임화,"비장함, 의심/불신, 화남/분노, 증오/혐오, 짜증","화남/분노, 증오/혐오, 안타까움/실망, 죄책감, 불안/걱정, 비장함, 서러움, 의심/불신","경악, 공포/무서움, 화남/분노","증오/혐오, 화남/분노, 비장함"
5434,영구히 숨줄을 끊을 수 있겠는가?,,주리라 네 탐내는 모든 것을,임화,"비장함, 의심/불신, 불안/걱정, 우쭐댐/무시함","기대감, 부담/안_내킴, 불안/걱정, 의심/불신, 신기함/관심","비장함, 증오/혐오","비장함, 슬픔, 힘듦/지침"
5435,자거라!,,주리라 네 탐내는 모든 것을,임화,"불안/걱정, 비장함, 귀찮음, 불쌍함/연민, 짜증, 화남/분노","아껴주는, 슬픔, 서러움, 안타까움/실망, 짜증, 비장함, 불안/걱정","짜증, 화남/분노","비장함, 불쌍함/연민, 아껴주는, 안타까움/실망"
5436,이제는 두번 살아 우리 앞에 나서지 못할,,주리라 네 탐내는 모든 것을,임화,"안타까움/실망, 불쌍함/연민, 절망, 불안/걱정","깨달음, 서러움, 슬픔, 안타까움/실망, 불안/걱정, 불쌍함/연민, 경악, 절망, 죄책감",안타까움/실망,"놀람, 당황/난처, 부담/안_내킴, 깨달음, 안타까움/실망"
5437,사랑하는 옛 벗 ‘××’아! 고이 자거라!,,주리라 네 탐내는 모든 것을,임화,"아껴주는, 환영/호의, 불쌍함/연민","불쌍함/연민, 비장함, 서러움, 슬픔, 아껴주는, 존경, 안타까움/실망","부담/안_내킴, 불쌍함/연민, 비장함, 서러움, 슬픔, 안타까움/실망","감동/감탄, 아껴주는, 안심/신뢰"
5438,지금 살아서 죽는 우리들과 함께.,,주리라 네 탐내는 모든 것을,임화,"불쌍함/연민, 깨달음, 환영/호의, 비장함","공포/무서움, 비장함, 서러움, 슬픔, 아껴주는, 안타까움/실망, 패배/자기혐오","비장함, 안타까움/실망","슬픔, 서러움, 힘듦/지침, 절망"
5439,누가 감히 네가,,주리라 네 탐내는 모든 것을,임화,"비장함, 증오/혐오, 화남/분노, 의심/불신, 불안/걱정, 경악, 당황/난처, 짜증","화남/분노, 우쭐댐/무시함, 불평/불만, 경악, 놀람, 증오/혐오, 어이없음","화남/분노, 짜증","경악, 놀람, 당황/난처, 화남/분노, 증오/혐오"
5440,영구히 죽었다고 말하겠는가?,,주리라 네 탐내는 모든 것을,임화,"신기함/관심, 안타까움/실망, 불쌍함/연민, 불안/걱정, 의심/불신, 패배/자기혐오, 부담/안_내킴","비장함, 서러움, 슬픔, 안타까움/실망, 부담/안_내킴, 어이없음","부담/안_내킴, 불평/불만, 비장함, 안타까움/실망","절망, 증오/혐오, 화남/분노, 힘듦/지침"
5441,불길은 타서 숯등걸 되고,,주리라 네 탐내는 모든 것을,임화,"신기함/관심, 없음","서러움, 비장함, 힘듦/지침, 불쌍함/연민, 존경, 슬픔, 신기함/관심",안타까움/실망,"슬픔, 안타까움/실망, 재미없음, 힘듦/지침"
5442,"그것은 일어날 새 불의 어머니 되나니,",,주리라 네 탐내는 모든 것을,임화,"깨달음, 비장함, 존경, 감동/감탄","존경, 기대감, 고마움, 감동/감탄, 환영/호의, 깨달음, 비장함","기대감, 비장함, 신기함/관심","감동/감탄, 기쁨, 기대감, 신기함/관심, 즐거움/신남"
5443,벗아! 저 컴컴한 골짝 속에서도,,주리라 네 탐내는 모든 것을,임화,"환영/호의, 기대감, 비장함, 아껴주는, 불쌍함/연민, 불안/걱정, 안심/신뢰, 서러움","아껴주는, 신기함/관심, 불안/걱정, 기대감, 환영/호의, 비장함, 서러움","기대감, 기쁨, 불안/걱정, 아껴주는, 뿌듯함, 환영/호의","감동/감탄, 기대감, 비장함, 신기함/관심, 아껴주는, 안심/신뢰"
5444,"오히려 머지않아 닥쳐올 대양의 큰 파도 소리를 자랑하며,",,주리라 네 탐내는 모든 것을,임화,"기대감, 비장함, 뿌듯함, 감동/감탄, 공포/무서움, 안심/신뢰, 우쭐댐/무시함, 환영/호의, 신기함/관심","서러움, 비장함, 기대감, 깨달음, 감동/감탄, 안심/신뢰, 환영/호의","기대감, 기쁨, 뿌듯함, 비장함","불안/걱정, 비장함"
5445,묵묵히 흐르는 실낱 냇물이 속삭이는,,주리라 네 탐내는 모든 것을,임화,"아껴주는, 흐뭇함(귀여움/예쁨), 신기함/관심","흐뭇함(귀여움/예쁨), 환영/호의, 행복, 편안/쾌적, 아껴주는, 신기함/관심, 기대감, 기쁨",신기함/관심,"비장함, 안심/신뢰"
5446,"옅은 콧노래 가운데,",,주리라 네 탐내는 모든 것을,임화,"즐거움/신남, 기대감, 흐뭇함(귀여움/예쁨), 뿌듯함, 기쁨, 신기함/관심","불안/걱정, 즐거움/신남, 편안/쾌적, 행복","기대감, 기쁨, 신기함/관심","감동/감탄, 기대감, 기쁨, 편안/쾌적"
5447,오는 날의 모든 것을 들으면서,,주리라 네 탐내는 모든 것을,임화,"기대감, 환영/호의, 비장함","기쁨, 비장함, 아껴주는, 기대감, 신기함/관심, 존경, 즐거움/신남, 환영/호의","기대감, 신기함/관심","감동/감탄, 기대감, 행복, 환영/호의"
5448,고이 두 손을 가슴에 얹어라!,,주리라 네 탐내는 모든 것을,임화,"비장함, 기대감, 깨달음, 존경, 환영/호의, 고마움, 감동/감탄","비장함, 우쭐댐/무시함, 아껴주는","비장함, 뿌듯함","감동/감탄, 기쁨, 비장함, 행복"
5449,이 아래 한길 되는 어둔 땅 속에,,주리라 네 탐내는 모든 것을,임화,"신기함/관심, 기대감","절망, 불쌍함/연민, 불안/걱정, 안타까움/실망, 서러움","부담/안_내킴, 불쌍함/연민, 슬픔, 안타까움/실망","경악, 공포/무서움, 불안/걱정, 절망, 증오/혐오, 힘듦/지침"
5450,지금 대양의 절규 대신에 잠잠한 침묵에 내가 잠자고 있노라!,,주리라 네 탐내는 모든 것을,임화,"비장함, 불안/걱정, 서러움, 슬픔, 화남/분노","비장함, 기대감, 서러움, 슬픔","깨달음, 비장함","비장함, 슬픔, 서러움, 절망, 힘듦/지침"
5451,무더운 여름 한밤의 깊은 어둠이,,옛 책,임화,"공포/무서움, 편안/쾌적, 불안/걱정, 신기함/관심","힘듦/지침, 귀찮음, 부담/안_내킴, 지긋지긋",부담/안_내킴,"불안/걱정, 부담/안_내킴, 슬픔, 절망, 힘듦/지침"
5452,모색의 힘든 노동에 오래 시달린,,옛 책,임화,"힘듦/지침, 불쌍함/연민","불쌍함/연민, 지긋지긋, 힘듦/지침, 서러움, 고마움","불쌍함/연민, 불안/걱정, 힘듦/지침","절망, 힘듦/지침, 지긋지긋"
5453,내 노력의 전신을 지그시 누른다.,,옛 책,임화,"힘듦/지침, 패배/자기혐오, 슬픔, 서러움, 공포/무서움, 당황/난처, 불안/걱정, 의심/불신","힘듦/지침, 아껴주는, 불쌍함/연민, 뿌듯함, 서러움, 슬픔, 환영/호의, 흐뭇함(귀여움/예쁨)","부담/안_내킴, 당황/난처","슬픔, 안타까움/실망, 힘듦/지침"
5454,"꺼칠한 눈썹 아래 푹 꺼진 두 눈,",,옛 책,임화,"힘듦/지침, 슬픔, 서러움, 절망, 공포/무서움, 패배/자기혐오","당황/난처, 경악, 놀람, 불쌍함/연민, 불안/걱정, 슬픔, 서러움, 아껴주는, 힘듦/지침, 공포/무서움","힘듦/지침, 불쌍함/연민","불안/걱정, 불평/불만, 의심/불신, 패배/자기혐오, 절망, 힘듦/지침"
5455,"한 끝이 먼 희망의 항구로 닿아 있어,",,옛 책,임화,"기대감, 깨달음, 놀람, 불안/걱정, 환영/호의, 아껴주는","기대감, 기쁨, 깨달음, 비장함, 신기함/관심, 불안/걱정, 행복","기대감, 기쁨, 신기함/관심, 환영/호의","불안/걱정, 슬픔, 기대감, 힘듦/지침"
5456,아이 때 쫓던 범나비 자취처럼,,옛 책,임화,"아껴주는, 신기함/관심, 불쌍함/연민, 환영/호의, 흐뭇함(귀여움/예쁨)","행복, 편안/쾌적, 아껴주는, 슬픔, 당황/난처, 깨달음, 안타까움/실망, 서러움","기대감, 기쁨, 안타까움/실망","슬픔, 부담/안_내킴"
5457,잡힐 듯 말 듯 젊은 날의 긴 동안을 고달피던,,옛 책,임화,"슬픔, 불안/걱정, 힘듦/지침, 안타까움/실망, 기대감, 당황/난처, 비장함, 서러움","절망, 서러움, 슬픔, 안타까움/실망, 힘듦/지침, 불평/불만, 불안/걱정, 지긋지긋, 짜증, 패배/자기혐오","부담/안_내킴, 안타까움/실망","불안/걱정, 슬픔, 서러움, 힘듦/지침"
5458,꿈길 아득한 옛 기억의 맵고 쓴 나머지를,,옛 책,임화,"불안/걱정, 안타까움/실망, 서러움, 슬픔","슬픔, 안타까움/실망, 부담/안_내킴, 지긋지긋","기대감, 불쌍함/연민, 서러움, 안타까움/실망","당황/난처, 불안/걱정, 부담/안_내킴, 슬픔"
5459,다시 그러모아 마음의 헌 누각을 중수하려,,옛 책,임화,"비장함, 서러움, 기대감, 깨달음","아껴주는, 비장함, 불쌍함/연민, 패배/자기혐오",비장함,"기대감, 즐거움/신남, 아껴주는, 신기함/관심"
5460,몇 번 힘을 내고 눈알을 굴려 방안에 좁은 하늘로 헤매었는가?,,옛 책,임화,"불안/걱정, 불쌍함/연민, 기대감, 안타까움/실망, 지긋지긋","한심함, 안타까움/실망, 불쌍함/연민, 불안/걱정, 불평/불만, 어이없음","당황/난처, 부담/안_내킴, 불평/불만","불안/걱정, 힘듦/지침, 패배/자기혐오"
5461,"검은 눈썹은 또다시 피로에 떨면서,",,옛 책,임화,"힘듦/지침, 불안/걱정, 부담/안_내킴","힘듦/지침, 불쌍함/연민","부담/안_내킴, 불쌍함/연민, 힘듦/지침","당황/난처, 부담/안_내킴, 불안/걱정, 불쌍함/연민, 불평/불만, 슬픔, 힘듦/지침"
5462,"길게 눈알을 덮고,",,옛 책,임화,"재미없음, 귀찮음, 부담/안_내킴, 지긋지긋","부담/안_내킴, 불안/걱정, 불평/불만, 지긋지긋, 귀찮음, 당황/난처, 재미없음",역겨움/징그러움,"비장함, 슬픔, 힘듦/지침, 절망"
5463,주검의 억센 품안에서 몸을 떨쳐 휘어나려,,옛 책,임화,"불안/걱정, 공포/무서움, 힘듦/지침, 부담/안_내킴, 당황/난처, 화남/분노","공포/무서움, 부담/안_내킴, 역겨움/징그러움, 짜증","공포/무서움, 부담/안_내킴, 비장함","비장함, 절망, 패배/자기혐오, 화남/분노"
5464,오늘도 어제와 같이 고된 격투(格鬪)에 시달린 육신은,,옛 책,임화,"힘듦/지침, 귀찮음, 불쌍함/연민, 비장함, 서러움","힘듦/지침, 부담/안_내킴, 불평/불만, 서러움, 지긋지긋","불쌍함/연민, 비장함, 안타까움/실망, 힘듦/지침","경악, 불쌍함/연민, 비장함, 슬픔, 힘듦/지침"
5465,푸근히 식은 땀의 생을 터치며,,옛 책,임화,"뿌듯함, 흐뭇함(귀여움/예쁨), 감동/감탄, 고마움, 아껴주는, 환영/호의","힘듦/지침, 흐뭇함(귀여움/예쁨), 뿌듯함, 즐거움/신남, 지긋지긋, 행복, 귀찮음","불쌍함/연민, 힘듦/지침","감동/감탄, 기쁨, 즐거움/신남"
5466,쪽 자리 위에 네 활개를 내어 던진다.,,옛 책,임화,"비장함, 힘듦/지침, 안타까움/실망","짜증, 귀찮음","기대감, 기쁨, 편안/쾌적","슬픔, 절망"
5467,그러면 벌써 나의 배는 파선하고 마는 것일까?,,옛 책,임화,"불안/걱정, 공포/무서움, 안타까움/실망, 슬픔, 절망","공포/무서움, 불안/걱정, 의심/불신, 당황/난처, 절망, 서러움","당황/난처, 부담/안_내킴, 불쌍함/연민, 불안/걱정, 안타까움/실망","경악, 공포/무서움, 당황/난처, 슬픔"
5468,"한 조각의 썩은 널조차 나를 돌보지 않고,",,옛 책,임화,"패배/자기혐오, 힘듦/지침, 절망, 서러움, 공포/무서움, 불안/걱정, 비장함","서러움, 슬픔, 안타까움/실망, 패배/자기혐오, 힘듦/지침","우쭐댐/무시함, 증오/혐오, 패배/자기혐오","경악, 당황/난처, 서러움, 슬픔, 지긋지긋, 힘듦/지침"
5469,"그것 없이는, 정말로 그것 없이는,",,옛 책,임화,"아껴주는, 깨달음, 불안/걱정, 안타까움/실망, 서러움, 비장함","아껴주는, 불안/걱정, 의심/불신, 서러움","당황/난처, 부담/안_내킴, 불쌍함/연민, 불안/걱정, 안타까움/실망","불평/불만, 안타까움/실망, 의심/불신"
5470,평탄한 물에서도 온전히 그 길을 찾을 수 없는,,옛 책,임화,"안타까움/실망, 슬픔, 서러움","당황/난처, 서러움, 안타까움/실망, 한심함, 어이없음","당황/난처, 부담/안_내킴, 안타까움/실망","서러움, 안타까움/실망, 절망, 슬픔"
5471,진리에로 향한 한 오리 가는 생명의 줄까지도,,옛 책,임화,"불쌍함/연민, 아껴주는, 비장함, 안타까움/실망, 슬픔","비장함, 서러움, 불안/걱정, 기대감, 감동/감탄, 신기함/관심, 안심/신뢰, 환영/호의","비장함, 아껴주는","기대감, 슬픔, 힘듦/지침, 비장함"
5472,"인제는 정말로 끊어져,",,옛 책,임화,"슬픔, 안타까움/실망, 서러움, 절망, 깨달음, 당황/난처","절망, 불쌍함/연민, 서러움, 안타까움/실망, 슬픔, 편안/쾌적","당황/난처, 부담/안_내킴, 안타까움/실망","경악, 슬픔, 절망, 힘듦/지침"
5473,손을 들어 최후의 인사를 고하려는가?,,옛 책,임화,"안타까움/실망, 당황/난처, 부담/안_내킴, 서러움, 슬픔, 비장함, 힘듦/지침","불안/걱정, 안타까움/실망","비장함, 의심/불신","기쁨, 환영/호의, 불안/걱정, 슬픔"
5474,"오오, 한 줌의 초라한 내 머리를 실어 오랫동안,",,옛 책,임화,"패배/자기혐오, 슬픔, 불안/걱정, 죄책감, 힘듦/지침","감동/감탄, 패배/자기혐오, 존경, 신기함/관심, 서러움, 슬픔, 고마움","당황/난처, 부담/안_내킴, 불평/불만, 패배/자기혐오","슬픔, 불안/걱정, 서러움, 힘듦/지침"
5475,한마디 군소리도 없이 오직 나를 위하여 충실하던 내 조그만 베개,,옛 책,임화,"고마움, 불쌍함/연민, 안심/신뢰, 편안/쾌적, 깨달음, 감동/감탄, 뿌듯함, 아껴주는, 행복","고마움, 뿌듯함, 아껴주는, 안심/신뢰, 환영/호의, 흐뭇함(귀여움/예쁨), 편안/쾌적, 감동/감탄, 기쁨, 행복","고마움, 기대감, 기쁨, 신기함/관심, 안심/신뢰, 아껴주는","불쌍함/연민, 서러움, 슬픔, 힘듦/지침"
5476,"반딧불만한 희망의 빛깔에도 불길처럼 타오르고,",,옛 책,임화,"기쁨, 감동/감탄, 기대감, 고마움, 비장함, 뿌듯함, 신기함/관심, 존경","비장함, 깨달음, 감동/감탄, 고마움, 기대감, 놀람, 안심/신뢰, 존경, 환영/호의, 기쁨","기대감, 아껴주는, 뿌듯함, 비장함","감동/감탄, 기대감, 비장함, 아껴주는"
5477,풀잎 하나 그 앞을 가리어도 천오 리 머리털이 활줄 같이 울던,,옛 책,임화,"안타까움/실망, 서러움, 슬픔, 불쌍함/연민","경악, 비장함, 안타까움/실망, 불안/걱정","부담/안_내킴, 불쌍함/연민, 서러움, 슬픔, 안타까움/실망","힘듦/지침, 절망, 경악, 당황/난처, 부담/안_내킴"
5478,청년의 마음을 실은 내 탐탁한 거루인 네가,,옛 책,임화,"아껴주는, 불쌍함/연민, 신기함/관심, 안심/신뢰, 환영/호의, 힘듦/지침, 고마움, 깨달음, 흐뭇함(귀여움/예쁨), 기대감","흐뭇함(귀여움/예쁨), 불안/걱정, 행복, 아껴주는, 기대감, 기쁨","비장함, 뿌듯함, 아껴주는","기대감, 아껴주는, 즐거움/신남, 행복, 환영/호의"
5479,"이제는 저무는 가을의 지는 잎 되어 거친 파도 가운데 엎드려지면서,",,옛 책,임화,"슬픔, 서러움, 안타까움/실망, 패배/자기혐오, 힘듦/지침, 불안/걱정","절망, 힘듦/지침, 공포/무서움, 경악, 부담/안_내킴, 불쌍함/연민, 불안/걱정, 서러움, 슬픔, 안타까움/실망","부담/안_내킴, 불쌍함/연민, 서러움, 안타까움/실망","절망, 힘듦/지침, 슬픔"
5480,그 최후의 인사에 공손히 대답하려는가?,,옛 책,임화,"화남/분노, 의심/불신, 불안/걱정, 불평/불만, 부담/안_내킴","존경, 한심함, 불평/불만, 비장함, 안타까움/실망, 어이없음","놀람, 의심/불신","불안/걱정, 슬픔, 비장함"
