ID,본문,소제목,제목,저자,annotator01,annotator02,annotator03,annotator04
2015,대망(待望)의 아득한 잠자리의 값을,,나는 못 믿겠노라,임화,"불안/걱정, 불평/불만, 부담/안_내킴","기대감, 기쁨, 즐거움/신남","비장함, 슬픔, 깨달음","경악, 당황/난처, 놀람, 안타까움/실망, 의심/불신, 불안/걱정"
2016,나는 허덕이는 가슴 위에 두 손길을 얹고 눈을 감아 금쳐 본다.,,나는 못 믿겠노라,임화,"불안/걱정, 힘듦/지침","불안/걱정, 힘듦/지침, 서러움",신기함/관심,"불안/걱정, 아껴주는"
2017,"“밤의 굳은 손이 우리의 몸과 마음을 사로잡아 누일 때,",,나는 못 믿겠노라,임화,"힘듦/지침, 공포/무서움, 귀찮음, 절망, 패배/자기혐오","힘듦/지침, 공포/무서움, 절망, 패배/자기혐오, 불안/걱정, 경악","공포/무서움, 부담/안_내킴, 불안/걱정, 힘듦/지침","비장함, 화남/분노, 슬픔, 서러움"
2018,그저 운명에 종용(從容)함이 오는 아침을 위(爲)하여 가장 현명(賢明)할 것이다.”,,나는 못 믿겠노라,임화,"비장함, 깨달음, 기대감",비장함,"깨달음, 비장함","깨달음, 비장함, 힘듦/지침"
2019,어찌 자네뿐이겠는가!,,나는 못 믿겠노라,임화,"고마움, 기쁨, 놀람, 즐거움/신남, 환영/호의, 우쭐댐/무시함","비장함, 불안/걱정, 아껴주는","놀람, 불쌍함/연민, 아껴주는","안타까움/실망, 비장함, 어이없음, 화남/분노"
2020,일찍이 선배인 어느 비평가의 논문도,,나는 못 믿겠노라,임화,없음,없음,신기함/관심,"안타까움/실망, 불안/걱정, 의심/불신"
2021,이 ‘냉정한 이성의 지혜로운 길’을,,나는 못 믿겠노라,임화,비장함,"비장함, 기대감, 불안/걱정, 감동/감탄",없음,"감동/감탄, 깨달음, 존경"
2022,"우리들이 걸어갈 유일의 길이라고 지시했음을,",,나는 못 믿겠노라,임화,"비장함, 깨달음","비장함, 깨달음, 기대감, 안심/신뢰","비장함, 기대감","의심/불신, 비장함"
2023,나는 다시 한 번 새롭게 기억한다.,,나는 못 믿겠노라,임화,"깨달음, 비장함, 흐뭇함(귀여움/예쁨), 기대감","비장함, 없음","깨달음, 놀람, 신기함/관심","기대감, 깨달음"
2024,"정말로 가시덤불은 무성하여 좁은 앞길을 덮고,",,나는 못 믿겠노라,임화,"절망, 부담/안_내킴, 불안/걱정, 의심/불신, 지긋지긋, 패배/자기혐오","불안/걱정, 공포/무서움, 당황/난처, 서러움, 슬픔, 안타까움/실망, 절망","경악, 공포/무서움, 놀람, 당황/난처, 비장함, 불안/걱정, 불평/불만, 안타까움/실망, 힘듦/지침","힘듦/지침, 불평/불만, 당황/난처, 불안/걱정"
2025,"깊은 밤 날씨는 언짢아, 두터운 암흑이",,나는 못 믿겠노라,임화,"불안/걱정, 공포/무서움, 절망","불안/걱정, 공포/무서움, 절망, 서러움","공포/무서움, 부담/안_내킴, 불안/걱정, 의심/불신","불안/걱정, 불평/불만, 의심/불신, 힘듦/지침"
2026,그 위에 자욱 누르고 있다.,,나는 못 믿겠노라,임화,"신기함/관심, 없음","불안/걱정, 서러움, 힘듦/지침, 안타까움/실망","부담/안_내킴, 당황/난처, 힘듦/지침","공포/무서움, 당황/난처, 불쌍함/연민, 불안/걱정, 불평/불만, 절망"
2027,이미,,나는 못 믿겠노라,임화,없음,없음,없음,"불안/걱정, 불평/불만, 슬픔, 안타까움/실망, 절망"
2028,"자네는 부상한 채 사로잡히고, 나는 병들어 누워,",,나는 못 믿겠노라,임화,패배/자기혐오,"패배/자기혐오, 불쌍함/연민, 안타까움/실망, 힘듦/지침, 서러움","불쌍함/연민, 불안/걱정, 서러움, 슬픔, 안타까움/실망, 절망, 패배/자기혐오, 한심함","절망, 패배/자기혐오, 힘듦/지침"
2029,벌써 몇 사람의 진실로 존귀한 목숨이,,나는 못 믿겠노라,임화,"아껴주는, 안타까움/실망, 불안/걱정","존경, 안타까움/실망, 불쌍함/연민, 서러움, 슬픔, 아껴주는","당황/난처, 안타까움/실망","감동/감탄, 기대감, 기쁨, 비장함, 안심/신뢰, 존경"
2030,고난에 찬 그 험한 길 위에 넘어졌는가?,,나는 못 믿겠노라,임화,"힘듦/지침, 불안/걱정, 안타까움/실망","힘듦/지침, 불안/걱정, 안타까움/실망, 불쌍함/연민, 서러움, 슬픔, 아껴주는, 놀람","당황/난처, 부담/안_내킴, 불안/걱정, 슬픔","불안/걱정, 의심/불신, 절망, 힘듦/지침"
2031,이제 우리들의 긴 대오는 허물어지고 ‘전선’은 어지럽다.,,나는 못 믿겠노라,임화,"절망, 경악, 공포/무서움, 불안/걱정","절망, 공포/무서움, 불안/걱정, 당황/난처, 안타까움/실망, 패배/자기혐오","당황/난처, 비장함, 슬픔","불안/걱정, 안타까움/실망, 슬픔, 힘듦/지침"
2032,그러나 이 사람!,,나는 못 믿겠노라,임화,"신기함/관심, 불평/불만, 짜증, 환영/호의","신기함/관심, 비장함",놀람,"화남/분노, 불안/걱정, 의심/불신, 슬픔"
2033,이 괴로운 밤이 다시 우리들을 찬란한 들판으로 나르는 대신,,나는 못 믿겠노라,임화,"서러움, 기대감, 비장함, 힘듦/지침, 환영/호의","당황/난처, 불안/걱정, 의심/불신","당황/난처, 부담/안_내킴, 안타까움/실망","부담/안_내킴, 불안/걱정, 슬픔, 의심/불신"
2034,이름도 없는 세월의 헛된 제물로,,나는 못 믿겠노라,임화,"서러움, 부담/안_내킴, 어이없음, 절망","서러움, 부담/안_내킴, 어이없음, 절망, 불평/불만, 안타까움/실망, 의심/불신, 지긋지긋, 한심함","부담/안_내킴, 불쌍함/연민, 서러움, 슬픔, 한심함, 힘듦/지침","안타까움/실망, 절망, 패배/자기혐오"
2035,번쩍 잡초 우거진 엉구렁 아래 메어치고 달아나지나 않을지?,,나는 못 믿겠노라,임화,"의심/불신, 불안/걱정","불안/걱정, 의심/불신","당황/난처, 의심/불신","불안/걱정, 불평/불만, 비장함, 의심/불신, 힘듦/지침"
2036,나는 벌레 먹어 무너져 가는 내 가슴이 맞이할 운명과 더불어,,나는 못 믿겠노라,임화,"서러움, 절망, 힘듦/지침, 부담/안_내킴","서러움, 절망, 힘듦/지침, 부담/안_내킴, 비장함, 불안/걱정, 안타까움/실망","당황/난처, 부담/안_내킴, 안타까움/실망, 증오/혐오, 패배/자기혐오, 한심함","슬픔, 절망"
2037,"몇 번 고단한 몸을 뒤척이고,",,나는 못 믿겠노라,임화,"힘듦/지침, 지긋지긋, 불안/걱정","힘듦/지침, 불안/걱정, 서러움",힘듦/지침,"불안/걱정, 힘듦/지침"
2038,"몇 번 괘종의 우는 소리를 들으면서,",,나는 못 믿겠노라,임화,"슬픔, 불안/걱정, 놀람","서러움, 슬픔, 불안/걱정",없음,"불안/걱정, 슬픔, 안타까움/실망"
2039,이 시커먼 파도 가운데서 대답을 찾으며 생각하였을까?,,나는 못 믿겠노라,임화,"불안/걱정, 기대감, 비장함, 공포/무서움","불안/걱정, 기대감, 비장함, 공포/무서움, 서러움, 불쌍함/연민, 슬픔, 힘듦/지침","당황/난처, 놀람, 불평/불만, 어이없음, 절망, 한심함","부담/안_내킴, 불안/걱정, 불평/불만, 의심/불신, 힘듦/지침"
2040,"내 수척한 육신은 기름땀내 잠기고,",,나는 못 믿겠노라,임화,"힘듦/지침, 지긋지긋, 역겨움/징그러움","힘듦/지침, 지긋지긋, 역겨움/징그러움, 패배/자기혐오, 한심함, 증오/혐오, 불쌍함/연민, 서러움","불쌍함/연민, 부끄러움, 불평/불만, 서러움, 안타까움/실망, 힘듦/지침","슬픔, 패배/자기혐오, 절망, 힘듦/지침"
2041,돌멩이처럼 머리는 침묵의 괴로운 바다 속으로 가라앉는다.,,나는 못 믿겠노라,임화,"서러움, 절망, 지긋지긋, 패배/자기혐오, 죄책감","서러움, 절망, 지긋지긋, 패배/자기혐오, 죄책감, 힘듦/지침, 불평/불만, 슬픔, 안타까움/실망","공포/무서움, 경악, 깨달음, 놀람, 당황/난처, 부담/안_내킴, 불안/걱정, 비장함","절망, 힘듦/지침, 패배/자기혐오, 슬픔"
2042,순간,,나는 못 믿겠노라,임화,"놀람, 없음","놀람, 없음, 불안/걱정","기대감, 없음","놀람, 당황/난처, 부담/안_내킴, 불안/걱정, 의심/불신"
2043,"나는 주위를 둘러싼 두터운 침묵이 무너지는 날카로운 소리에,",,나는 못 믿겠노라,임화,"놀람, 공포/무서움, 당황/난처, 경악","놀람, 공포/무서움, 당황/난처, 경악, 불안/걱정","경악, 놀람, 비장함","슬픔, 절망, 힘듦/지침"
2044,비로소 보이지도 않게 방안 가득 진 친 셀 수도 없는 모기떼의,,나는 못 믿겠노라,임화,"역겨움/징그러움, 지긋지긋, 짜증","역겨움/징그러움, 지긋지긋, 공포/무서움, 불안/걱정, 경악, 놀람, 당황/난처, 증오/혐오","귀찮음, 공포/무서움, 경악, 불평/불만","불평/불만, 지긋지긋, 힘듦/지침"
2045,무수한 입추리 가운데,,나는 못 믿겠노라,임화,없음,"기대감, 불안/걱정, 신기함/관심",없음,"의심/불신, 절망"
2046,참담히 누워있는 내 육신의 전모를,,나는 못 믿겠노라,임화,"패배/자기혐오, 힘듦/지침, 귀찮음, 부담/안_내킴","패배/자기혐오, 힘듦/지침, 귀찮음, 부담/안_내킴, 서러움, 슬픔, 안타까움/실망, 한심함","공포/무서움, 깨달음, 당황/난처, 부담/안_내킴, 슬픔, 서러움, 비장함","힘듦/지침, 절망, 패배/자기혐오"
2047,나는 모진 아픔과 몸서리를 같이 발견했다.,,나는 못 믿겠노라,임화,"서러움, 슬픔, 패배/자기혐오, 절망, 힘듦/지침","서러움, 슬픔, 절망, 힘듦/지침, 불안/걱정, 안타까움/실망","당황/난처, 불쌍함/연민, 불안/걱정, 부담/안_내킴, 슬픔, 서러움","깨달음, 슬픔, 절망, 힘듦/지침"
2048,"오오, 이 밤의 어두운 꿀이",,나는 못 믿겠노라,임화,"감동/감탄, 기대감, 놀람, 신기함/관심","감동/감탄, 놀람, 불안/걱정, 공포/무서움, 신기함/관심","감동/감탄, 기대감, 기쁨, 신기함/관심, 행복","부담/안_내킴, 불안/걱정, 의심/불신"
2049,그들의 온갖 활동에 얼마나 크고 넓은 자유를 주는 것일까?,,나는 못 믿겠노라,임화,"의심/불신, 불안/걱정, 놀람, 부담/안_내킴, 감동/감탄, 신기함/관심, 존경","감동/감탄, 놀람, 불안/걱정, 신기함/관심","놀람, 불쌍함/연민, 불평/불만, 의심/불신","의심/불신, 화남/분노, 힘듦/지침, 불평/불만"
2050,암석까지도 진땀을 내뿜는 이 계절의 진한 입김이,,나는 못 믿겠노라,임화,"신기함/관심, 기대감","비장함, 신기함/관심, 감동/감탄","경악, 부담/안_내킴, 불안/걱정, 증오/혐오, 힘듦/지침","경악, 놀람, 불안/걱정, 의심/불신"
2051,그들의 엷은 두 날개를 얼마나 가볍고 굳세게 만들어 주는 것일까?,,나는 못 믿겠노라,임화,"기대감, 신기함/관심, 비장함, 존경, 감동/감탄","기대감, 신기함/관심, 존경, 감동/감탄, 놀람, 기쁨, 아껴주는","감동/감탄, 놀람, 신기함/관심","의심/불신, 불안/걱정"
2052,그러나 우리는,,나는 못 믿겠노라,임화,없음,"없음, 기대감, 비장함",없음,"불안/걱정, 의심/불신, 절망"
2053,"이 가운데서 보고 아는 모든 자유를 죽여가고,",,나는 못 믿겠노라,임화,"화남/분노, 패배/자기혐오, 슬픔, 안타까움/실망","화남/분노, 패배/자기혐오, 슬픔, 안타까움/실망, 경악, 불안/걱정, 서러움, 절망, 증오/혐오","놀람, 깨달음, 당황/난처, 부담/안_내킴, 불안/걱정, 슬픔","절망, 화남/분노, 의심/불신"
2054,‘습격자’를 향하여 몸을 일으킬 육신의 적은 힘까지도 잃어간다.,,나는 못 믿겠노라,임화,"깨달음, 증오/혐오, 귀찮음, 불평/불만, 힘듦/지침","힘듦/지침, 당황/난처, 경악, 서러움, 슬픔, 불안/걱정, 안타까움/실망, 패배/자기혐오","감동/감탄, 깨달음, 슬픔","불안/걱정, 절망, 힘듦/지침"
2055,"앵! 아우성소리 치며 눈 위를 감돌고,",,나는 못 믿겠노라,임화,"놀람, 공포/무서움, 불안/걱정","놀람, 불안/걱정, 신기함/관심, 경악",놀람,"경악, 절망, 화남/분노, 의심/불신, 증오/혐오"
2056,"소리개처럼 탁 귓전을 후려,",,나는 못 믿겠노라,임화,"놀람, 불안/걱정","놀람, 불안/걱정, 경악, 당황/난처","놀람, 당황/난처","놀람, 즐거움/신남"
2057,"이 밤의 아픔의 가장 혹독한 전초(前帩)들은 꽉 뒷다리를 버티고,",,나는 못 믿겠노라,임화,"서러움, 비장함, 부담/안_내킴, 불안/걱정, 힘듦/지침","서러움, 비장함, 불안/걱정, 힘듦/지침, 불쌍함/연민","공포/무서움, 부담/안_내킴, 불안/걱정, 절망, 슬픔","불안/걱정, 경악, 힘듦/지침, 절망"
2058,"우리들의 몸에 입추리를 꽂아,",,나는 못 믿겠노라,임화,"의심/불신, 당황/난처, 부담/안_내킴","의심/불신, 당황/난처, 부담/안_내킴, 서러움, 불안/걱정",비장함,"경악, 역겨움/징그러움, 화남/분노, 짜증"
2059,밤이 주고 그들이 탐내는 모든 것을,,나는 못 믿겠노라,임화,"환영/호의, 비장함, 깨달음","비장함, 서러움, 불안/걱정, 당황/난처, 의심/불신, 화남/분노",없음,"안타까움/실망, 의심/불신, 불평/불만, 힘듦/지침"
2060,우리들의 전신에서 약탈한 참혹한 자유를 향락하고 있다.,,나는 못 믿겠노라,임화,"슬픔, 화남/분노, 증오/혐오","슬픔, 화남/분노, 증오/혐오, 경악, 서러움, 공포/무서움, 한심함, 불평/불만, 안타까움/실망","경악, 부담/안_내킴, 불평/불만, 안타까움/실망, 의심/불신, 절망, 증오/혐오, 화남/분노","불안/걱정, 절망, 증오/혐오, 화남/분노"
2061,"오, 지금은 육촉 전등 흐릿한 좁다란 마루판자,",,나는 못 믿겠노라,임화,"감동/감탄, 신기함/관심, 없음","불쌍함/연민, 불평/불만, 서러움","불쌍함/연민, 불안/걱정, 안타까움/실망","불안/걱정, 비장함, 슬픔, 힘듦/지침, 절망"
2062,"굵은 창살이 네모진 하늘을 두부같이 저며 놓은 높다란 들창 아래,",,나는 못 믿겠노라,임화,"불안/걱정, 재미없음","불안/걱정, 공포/무서움, 서러움, 불평/불만, 안타까움/실망, 패배/자기혐오","부담/안_내킴, 안타까움/실망","절망, 패배/자기혐오, 힘듦/지침"
2063,내 자네의 여윈 몸은,,나는 못 믿겠노라,임화,"안타까움/실망, 불쌍함/연민","불쌍함/연민, 불안/걱정, 서러움, 슬픔, 아껴주는, 안타까움/실망","불쌍함/연민, 신기함/관심, 안타까움/실망","불쌍함/연민, 불안/걱정, 슬픔, 안타까움/실망"
2064,고된 일에 넘어진 마소처럼 쓰러져 있지 않은가?,,나는 못 믿겠노라,임화,"뿌듯함, 신기함/관심, 아껴주는","아껴주는, 불쌍함/연민, 불안/걱정, 서러움, 슬픔, 힘듦/지침","부끄러움, 불안/걱정, 슬픔, 의심/불신, 화남/분노, 힘듦/지침","불쌍함/연민, 슬픔, 아껴주는, 힘듦/지침"
2065,얼마나 이 밤의 죄악의 통렬한 집행자들은,,나는 못 믿겠노라,임화,"경악, 증오/혐오, 놀람, 비장함","경악, 증오/혐오, 당황/난처, 불안/걱정, 불평/불만, 의심/불신, 짜증, 화남/분노","부담/안_내킴, 불안/걱정, 불평/불만, 의심/불신, 증오/혐오, 화남/분노","경악, 불안/걱정, 의심/불신, 역겨움/징그러움, 증오/혐오, 화남/분노"
2066,무참하고 아프게 그 입추리를 박았을까?,,나는 못 믿겠노라,임화,"불안/걱정, 경악, 안타까움/실망","불안/걱정, 경악, 안타까움/실망, 불평/불만, 서러움, 의심/불신, 화남/분노, 아껴주는","경악, 불쌍함/연민, 불안/걱정, 안타까움/실망","화남/분노, 안타까움/실망, 의심/불신"
2067,"비비여 죽여도, 눌러 죽여도,",,나는 못 믿겠노라,임화,"비장함, 없음","비장함, 슬픔","경악, 당황/난처, 역겨움/징그러움, 지긋지긋, 짜증","절망, 힘듦/지침"
2068,"벗아, 내 분함이 어찌 풀리겠는가?",,나는 못 믿겠노라,임화,"화남/분노, 불평/불만, 짜증","화남/분노, 불평/불만, 서러움, 슬픔, 안타까움/실망, 불안/걱정","당황/난처, 부담/안_내킴, 화남/분노","불평/불만, 비장함, 화남/분노, 증오/혐오, 서러움, 절망"
2069,"자네, 이 모진 아픔에 잠들 수 있겠는가?",,나는 못 믿겠노라,임화,"의심/불신, 한심함, 화남/분노, 경악, 놀람","한심함, 화남/분노, 경악, 불쌍함/연민, 불평/불만, 비장함, 서러움, 아껴주는, 지긋지긋","서러움, 슬픔, 비장함, 어이없음, 절망, 짜증, 화남/분노, 힘듦/지침","비장함, 슬픔, 힘듦/지침"
2070,"자네, 이 무거운 더위에 숨쉴 수 있겠는가? 그리고 아직도",,나는 못 믿겠노라,임화,"의심/불신, 불안/걱정, 불쌍함/연민, 신기함/관심, 힘듦/지침","불안/걱정, 불쌍함/연민, 당황/난처","귀찮음, 부담/안_내킴, 절망, 힘듦/지침, 지긋지긋, 짜증","절망, 힘듦/지침"
2071,오는 아침 우리는 정말 건전할 수 있겠는가?,,나는 못 믿겠노라,임화,"불안/걱정, 의심/불신, 경악, 당황/난처, 부담/안_내킴, 슬픔, 비장함, 지긋지긋","불안/걱정, 공포/무서움, 부끄러움, 서러움, 슬픔, 안타까움/실망, 의심/불신","부담/안_내킴, 불안/걱정, 비장함, 슬픔","불안/걱정, 기대감, 불평/불만"
2072,"오오, 몸을 일으키어 두 팔을 걷어라.",,나는 못 믿겠노라,임화,"비장함, 기대감","비장함, 기대감, 아껴주는, 환영/호의","기대감, 비장함","기대감, 비장함"
2073,"그리하여 네 손에 닿는 모든 것을 잡아,",,나는 못 믿겠노라,임화,"환영/호의, 비장함","비장함, 기대감, 불안/걱정",없음,"비장함, 화남/분노"
2074,"이 졸음과 생각을 다 한데 깨치고,",,나는 못 믿겠노라,임화,"재미없음, 깨달음, 비장함","재미없음, 비장함, 깨달음, 불평/불만","감동/감탄, 기대감, 환영/호의","힘듦/지침, 불안/걱정"
2075,바로 우리 병들고 수척한 육신을 쥐어뜯는,,나는 못 믿겠노라,임화,"지긋지긋, 힘듦/지침, 패배/자기혐오","지긋지긋, 힘듦/지침, 패배/자기혐오, 불안/걱정, 공포/무서움, 서러움, 안타까움/실망, 절망","슬픔, 서러움, 불쌍함/연민, 불평/불만","불안/걱정, 불평/불만, 증오/혐오, 의심/불신, 화남/분노"
2076,"밤의 미운 초병단(哨兵團)을 향하여,",,나는 못 믿겠노라,임화,"기대감, 증오/혐오, 화남/분노, 비장함","증오/혐오, 화남/분노, 비장함","부담/안_내킴, 불평/불만, 의심/불신, 증오/혐오, 지긋지긋, 짜증","불평/불만, 의심/불신, 안타까움/실망, 지긋지긋"
2077,주검으로써 야격(夜擊)에 일어서라.,,나는 못 믿겠노라,임화,"비장함, 화남/분노","비장함, 서러움, 화남/분노","깨달음, 부담/안_내킴, 불안/걱정, 비장함, 의심/불신","비장함, 화남/분노, 뿌듯함"
2078,만일 우리가,,나는 못 믿겠노라,임화,"기대감, 없음","기대감, 없음, 불안/걱정","없음, 기대감","기대감, 깨달음, 환영/호의"
2079,"자네와 그 아류(亞流)들이 말하는 거룩한 철리(哲理)를 좇는다면,",,나는 못 믿겠노라,임화,"우쭐댐/무시함, 불안/걱정, 의심/불신, 부담/안_내킴","우쭐댐/무시함, 불안/걱정, 의심/불신, 한심함, 짜증, 안타까움/실망, 재미없음","부담/안_내킴, 불평/불만, 어이없음, 의심/불신, 우쭐댐/무시함","의심/불신, 증오/혐오, 한심함"
2080,닭이 홰를 치고 바자 밑에 울며,,나는 못 믿겠노라,임화,"슬픔, 없음","불쌍함/연민, 불안/걱정","놀람, 부담/안_내킴, 불안/걱정",없음
2081,"이놈의 일족(一族)이 밤과 더불어 숲속에 물러갈 그 때,",,나는 못 믿겠노라,임화,"불안/걱정, 당황/난처, 비장함, 죄책감, 패배/자기혐오","공포/무서움, 불안/걱정","감동/감탄, 불안/걱정, 의심/불신, 힘듦/지침","불안/걱정, 의심/불신"
2082,우리들은 두엄이 되어 굴욕의 들판에 넘어졌을 것이다.,,나는 못 믿겠노라,임화,"패배/자기혐오, 비장함, 절망, 서러움","패배/자기혐오, 비장함, 절망, 서러움, 슬픔, 불안/걱정, 안타까움/실망, 힘듦/지침","깨달음, 부담/안_내킴, 안타까움/실망, 패배/자기혐오","비장함, 화남/분노"
2083,나는,,나는 못 믿겠노라,임화,없음,없음,없음,없음
2084,우리들의 육신을 뜯기지도 않고,,나는 못 믿겠노라,임화,"비장함, 의심/불신, 공포/무서움, 불안/걱정","비장함, 공포/무서움, 불안/걱정, 서러움","놀람, 신기함/관심","경악, 공포/무서움, 절망"
2085,우리들을 헛되이 늙히지도 않는,,나는 못 믿겠노라,임화,"비장함, 없음, 아껴주는","비장함, 아껴주는, 고마움, 기대감, 불안/걱정, 서러움, 환영/호의","부담/안_내킴, 불평/불만","의심/불신, 불안/걱정"
2086,그렇게 착한 여름밤이 있다는 신화와 함께,,나는 못 믿겠노라,임화,"기대감, 아껴주는, 환영/호의, 없음","기대감, 아껴주는, 환영/호의, 감동/감탄, 기쁨","감동/감탄, 깨달음, 신기함/관심","기대감, 행복"
2087,내일을 위하여 맘의 아픔에 종용(從容)하라는,,나는 못 믿겠노라,임화,"기대감, 슬픔, 부담/안_내킴, 지긋지긋, 죄책감, 서러움","비장함, 기대감, 부담/안_내킴, 불안/걱정, 불평/불만, 서러움, 어이없음, 짜증","감동/감탄, 깨달음, 당황/난처, 부담/안_내킴, 불평/불만","당황/난처, 불안/걱정, 슬픔, 안타까움/실망, 의심/불신, 절망"
2088,그 거룩한 철리를 믿을 수는 없다.,,나는 못 믿겠노라,임화,"의심/불신, 우쭐댐/무시함, 부담/안_내킴, 불안/걱정, 불평/불만","의심/불신, 우쭐댐/무시함, 부담/안_내킴, 불평/불만, 비장함, 서러움, 한심함","슬픔, 없음","불안/걱정, 의심/불신, 증오/혐오"
2089,까만 발들이 바쁘게 지나간다.,,골프장,임화,"공포/무서움, 없음","불안/걱정, 놀람, 신기함/관심","놀람, 당황/난처","불안/걱정, 불평/불만, 의심/불신, 한심함"
2090,"이슬방울이 우수수 떨어지며,",,골프장,임화,"슬픔, 서러움, 없음, 신기함/관심","서러움, 신기함/관심, 불안/걱정","불안/걱정, 슬픔",없음
2091,흙 새에 끼었던 흰 모래알이,,골프장,임화,없음,"신기함/관심, 불안/걱정",신기함/관심,신기함/관심
2092,의붓자식처럼 한 귀퉁이에 밀려난다.,,골프장,임화,"안타까움/실망, 당황/난처","안타까움/실망, 당황/난처, 서러움, 슬픔, 불쌍함/연민, 화남/분노","부담/안_내킴, 불쌍함/연민, 서러움, 슬픔, 안타까움/실망","불안/걱정, 불평/불만, 증오/혐오, 지긋지긋"
2093,그러면 어린 풀잎들이 느껴 운다.,,골프장,임화,"슬픔, 서러움, 불쌍함/연민","슬픔, 서러움, 불쌍함/연민, 불안/걱정, 아껴주는","불쌍함/연민, 서러움, 슬픔, 안타까움/실망","불쌍함/연민, 슬픔, 안타까움/실망"
2094,"뭐, 인젠 그 연한 풀잎이",,골프장,임화,"불쌍함/연민, 불안/걱정, 신기함/관심, 흐뭇함(귀여움/예쁨)","불안/걱정, 서러움, 안타까움/실망, 흐뭇함(귀여움/예쁨), 아껴주는","감동/감탄, 깨달음, 신기함/관심, 아껴주는, 흐뭇함(귀여움/예쁨)","불쌍함/연민, 안타까움/실망, 불안/걱정, 아껴주는"
2095,알몸으로 뙤약볕을 쏘여야 하니까……,,골프장,임화,"부담/안_내킴, 부끄러움, 불안/걱정, 불평/불만, 짜증, 지긋지긋, 죄책감","부담/안_내킴, 부끄러움, 불안/걱정, 지긋지긋, 서러움, 슬픔, 안타까움/실망, 힘듦/지침","당황/난처, 슬픔, 서러움, 역겨움/징그러움, 힘듦/지침","불쌍함/연민, 불안/걱정, 안타까움/실망"
2096,"정말 가는 이파리들은 아직 나이 어려도,",,골프장,임화,"기대감, 뿌듯함, 흐뭇함(귀여움/예쁨)","기대감, 뿌듯함, 흐뭇함(귀여움/예쁨)","비장함, 깨달음, 기대감, 신기함/관심, 흐뭇함(귀여움/예쁨)","불안/걱정, 불쌍함/연민, 슬픔, 안타까움/실망"
2097,염천(炎天) 아래서 찌는 듯한 폭양(暴陽)을 온종일 받아야 할 쓰라림을 잘 알고 있다.,,골프장,임화,"안타까움/실망, 슬픔, 힘듦/지침, 지긋지긋","불쌍함/연민, 힘듦/지침, 안타까움/실망, 서러움, 슬픔, 불안/걱정, 공포/무서움","불평/불만, 지긋지긋, 짜증, 힘듦/지침","불평/불만, 지긋지긋, 힘듦/지침"
2098,외국말을 쓴 세모난 다홍 기가,,골프장,임화,없음,"없음, 신기함/관심, 불안/걱정",놀람,"부담/안_내킴, 당황/난처, 불평/불만, 의심/불신, 한심함"
2099,승리자처럼 흰 깃대 위에 너울거린다.,,골프장,임화,"비장함, 우쭐댐/무시함, 기쁨","감동/감탄, 뿌듯함, 우쭐댐/무시함","기쁨, 뿌듯함, 우쭐댐/무시함, 행복","불평/불만, 의심/불신"
