ID,본문,소제목,제목,저자,annotator01,annotator02,annotator03,annotator04
3632,당신의 시(詩)는 봄비에 새로 눈뜨는 금결(金結) 같은 버들이어요,,「사랑」을 사랑하여요,한용운,"기대감, 존경, 환영/호의, 기쁨, 감동/감탄","존경, 감동/감탄, 아껴주는, 흐뭇함(귀여움/예쁨)","깨달음, 신기함/관심, 아껴주는, 행복, 기쁨, 기대감","감동/감탄, 기쁨, 행복, 환영/호의, 흐뭇함(귀여움/예쁨), 즐거움/신남"
3633,그러나 기름 같은 검은 바다에 피어오르는 백합꽃(百合花) 같은 시(詩)가 없는 것이 아닙니다,,「사랑」을 사랑하여요,한용운,"기대감, 깨달음, 불안/걱정, 환영/호의, 흐뭇함(귀여움/예쁨)","기대감, 깨달음, 불안/걱정, 환영/호의, 흐뭇함(귀여움/예쁨), 감동/감탄, 고마움, 안심/신뢰, 아껴주는","깨달음, 힘듦/지침, 감동/감탄","비장함, 뿌듯함, 힘듦/지침, 존경"
3634,만일 좋은 문장(文章)만을 사랑한다면 왜 내가 꽃을 노래하지 않고 버들을 찬미(讚美)하여요,,「사랑」을 사랑하여요,한용운,"아껴주는, 깨달음, 환영/호의, 불쌍함/연민, 안타까움/실망","아껴주는, 기쁨, 행복","기대감, 신기함/관심, 아껴주는","기쁨, 아껴주는, 행복"
3635,온세상 사람이 나를 사랑하지 아니할 때에 당신만이 나를 사랑하였습니다,,「사랑」을 사랑하여요,한용운,"비장함, 고마움, 깨달음, 기쁨, 환영/호의, 감동/감탄, 아껴주는, 신기함/관심","비장함, 서러움, 슬픔, 아껴주는, 안심/신뢰, 행복, 고마움, 환영/호의","고마움, 기쁨, 서러움, 아껴주는, 존경, 행복","아껴주는, 안심/신뢰, 행복, 기쁨, 존경"
3636,나는 당신을 사랑하여요 나는 당신의 「사랑」을 사랑하여요,,「사랑」을 사랑하여요,한용운,"아껴주는, 존경, 환영/호의","기쁨, 비장함, 깨달음, 서러움, 아껴주는, 존경, 행복","기대감, 기쁨, 아껴주는, 존경, 흐뭇함(귀여움/예쁨)","고마움, 기쁨, 아껴주는, 행복"
3637,나는 잠자리에 누어서 자다가 깨고 깨다가 잘 때에 외로운 등잔불은 각근(恪勤)한 파수군(把守軍)처럼 온 밤을 지킵니다,,버리지 아니하면,한용운,"불안/걱정, 불쌍함/연민","불안/걱정, 불쌍함/연민, 서러움, 슬픔, 안심/신뢰, 고마움, 힘듦/지침","비장함, 뿌듯함, 아껴주는","불안/걱정, 힘듦/지침, 안심/신뢰"
3638,당신이 나를 버리지 아니하면 나는 일생(一生)의 등잔불이 되어서 당신의 백년(百年)을 지키겠습니다,,버리지 아니하면,한용운,"비장함, 아껴주는, 환영/호의","비장함, 아껴주는, 환영/호의, 서러움, 슬픔","비장함, 아껴주는","비장함, 안심/신뢰"
3639,나는 책상 앞에 앉아서 여러 가지 글을 볼 때에 내가 요구(要求)만 하면 글은 좋은 이야기도 하고 맑은 노래도 부르고 엄숙한 교훈(敎訓)도 줍니다,,버리지 아니하면,한용운,"고마움, 신기함/관심, 뿌듯함, 흐뭇함(귀여움/예쁨), 존경, 즐거움/신남, 기쁨","고마움, 신기함/관심, 뿌듯함, 존경, 즐거움/신남, 기쁨, 감동/감탄, 안심/신뢰, 행복","깨달음, 뿌듯함, 편안/쾌적","감동/감탄, 행복, 존경, 기쁨"
3640,당신이 나를 버리지 아니하면 나는 복종(服從)의 백과전서(百科全書)가 되어서 당신의 요구(要求)를 수응(酬應)하겠습니다,,버리지 아니하면,한용운,"비장함, 환영/호의, 기대감, 존경, 아껴주는, 안심/신뢰","비장함, 아껴주는, 안심/신뢰, 존경","기대감, 불쌍함/연민, 불안/걱정, 비장함, 힘듦/지침","기대감, 비장함, 아껴주는, 안심/신뢰"
3641,나는 거울을 대하여 당신의 키스를 기다리는 입술을 볼 때에 속임 없는 거울은 내가 웃으면 거울도 웃고 내가 찡그리면 거울도 찡그립니다,,버리지 아니하면,한용운,"아껴주는, 깨달음, 기대감, 신기함/관심, 환영/호의","아껴주는, 신기함/관심, 한심함, 불쌍함/연민, 안타까움/실망","부담/안_내킴, 안타까움/실망, 패배/자기혐오","아껴주는, 슬픔, 없음"
3642,당신이 나를 버리지 아니하면 나는 마음의 거울이 되어서 속임 없이 당신의 고락(苦樂)을 같이하겠습니다,,버리지 아니하면,한용운,"비장함, 아껴주는, 존경, 환영/호의","아껴주는, 존경, 불안/걱정, 비장함, 안심/신뢰","기대감, 깨달음, 비장함, 존경, 안심/신뢰","비장함, 아껴주는, 안심/신뢰, 환영/호의"
3643,가을 홍수(洪水)가 작은 시내의 쌓인 낙엽(落葉)을 휩쓸어가듯이 당신은 나의 환락(歡樂)의 마음을 빼앗아갔습니다 나에게 남은 마음은 고통(苦痛)뿐입니다,,요술,한용운,"슬픔, 안타까움/실망, 절망, 힘듦/지침","불안/걱정, 불평/불만, 비장함, 서러움, 슬픔, 안타까움/실망, 절망, 힘듦/지침","당황/난처, 부담/안_내킴, 불쌍함/연민, 서러움, 안타까움/실망, 절망","슬픔, 서러움, 힘듦/지침, 안타까움/실망, 지긋지긋"
3644,그러나 나는 당신을 원망할 수는 없습니다 당신이 가기 전에는 나의 고통(苦痛)의 마음을 빼앗아간 까닭입니다,,요술,한용운,"고마움, 안타까움/실망, 깨달음, 아껴주는","고마움, 비장함, 서러움, 슬픔, 아껴주는, 깨달음","불쌍함/연민, 불안/걱정, 비장함, 서러움, 슬픔, 안타까움/실망","슬픔, 절망, 서러움"
3645,만일 당신이 환락(歡樂)의 마음과 고통(苦痛)의 마음을 동시에 빼앗아간다 하면 나에게는 아무 마음도 없겠습니다,,요술,한용운,"깨달음, 고마움, 패배/자기혐오, 존경","당황/난처, 불안/걱정, 부담/안_내킴, 서러움, 슬픔, 안타까움/실망","당황/난처, 부담/안_내킴, 불평/불만, 서러움, 안타까움/실망","안타까움/실망, 슬픔, 절망"
3646,나는 하늘의 별이 되어서 구름의 면사(面紗)로 낯을 가리고 숨어 있겠습니다,,요술,한용운,"흐뭇함(귀여움/예쁨), 비장함","부끄러움, 기쁨, 당황/난처, 아껴주는","놀람, 당황/난처, 부끄러움","비장함, 슬픔"
3647,나는 바다의 진주(眞珠)가 되었다가 당신의 구두에 단추가 되겠습니다,,요술,한용운,"아껴주는, 깨달음, 환영/호의, 존경, 비장함","존경, 아껴주는, 비장함, 행복","감동/감탄, 기쁨, 비장함, 안심/신뢰, 즐거움/신남, 행복","아껴주는, 행복, 기쁨"
3648,당신이 만일 별과 진주(眞珠)를 따서 게다가 마음을 넣어 다시 당신의 님을 만든다면 그때에는 환락(歡樂)의 마음을 넣어 주셔요,,요술,한용운,"아껴주는, 기대감, 고마움, 슬픔","아껴주는, 기대감, 슬픔, 서러움, 불평/불만, 불쌍함/연민","비장함, 기대감, 슬픔","아껴주는, 기대감, 환영/호의"
3649,부득히 고통(苦痛)의 마음도 넣어야 하겠거든 당신의 고통(苦痛)을 빼어다가 넣어 주셔요,,요술,한용운,"아껴주는, 불쌍함/연민, 불안/걱정","아껴주는, 불쌍함/연민, 불안/걱정, 비장함, 서러움, 슬픔, 환영/호의","비장함, 아껴주는","비장함, 아껴주는, 불쌍함/연민"
3650,그리고 마음을 빼앗아 가는 요술(妖術)은 나에게는 가르쳐 주지 마셔요,,요술,한용운,"안타까움/실망, 불평/불만, 의심/불신, 지긋지긋, 짜증","불평/불만, 불안/걱정, 환영/호의, 기대감, 서러움, 행복","당황/난처, 부담/안_내킴, 불쌍함/연민, 불안/걱정","부담/안_내킴, 불안/걱정, 의심/불신"
3651,그러면 지금의 이별이 사랑의 최후(最後)은 아닙니다,,요술,한용운,"슬픔, 비장함, 기대감, 깨달음","비장함, 안심/신뢰, 서러움, 기쁨","깨달음, 불안/걱정, 비장함","기대감, 슬픔, 비장함"
3652,당신이 계실 때에는 겨울밤이 짧더니 당신이 가신 뒤에는 여름밤이 길어요,,여름밤이 길어요,한용운,"서러움, 슬픔, 안타까움/실망, 깨달음, 지긋지긋","아껴주는, 서러움, 슬픔, 깨달음, 놀람, 재미없음, 안타까움/실망, 지긋지긋","불쌍함/연민, 안타까움/실망","슬픔, 안타까움/실망, 절망, 재미없음, 지긋지긋, 힘듦/지침"
3653,책력(冊曆)의 내용(內容)이 그릇되었나 하였더니 개똥불이 흐르고 벌레가 웁니다,,여름밤이 길어요,한용운,"놀람, 의심/불신, 깨달음","놀람, 의심/불신, 불안/걱정","감동/감탄, 놀람, 존경","당황/난처, 불안/걱정, 슬픔, 힘듦/지침"
3654,긴 밤은 어디서 오고 어디로 가는 줄을 분명히 알았습니다,,여름밤이 길어요,한용운,깨달음,"깨달음, 서러움, 슬픔, 안타까움/실망","깨달음, 없음",깨달음
3655,긴 밤은 근심 바다의 첫 물결에서 나와서 슬픈 음악(音樂)이 되고 아득한 사막(沙漠)이 되더니 필경 절망(絶望)의 성(城) 너머로 가서 악마(惡魔)의 웃음 속으로 들어갑니다,,여름밤이 길어요,한용운,"슬픔, 절망, 깨달음","슬픔, 절망, 깨달음, 불안/걱정, 공포/무서움, 경악, 서러움, 안타까움/실망","공포/무서움, 놀람, 불안/걱정, 절망, 화남/분노","깨달음, 절망, 힘듦/지침, 불안/걱정"
3656,그러나 당신이 오시면 나는 사랑의 칼을 가지고 긴 밤을 베혀서 일천(一千) 토막을 내겠습니다,,여름밤이 길어요,한용운,"비장함, 아껴주는","비장함, 아껴주는, 기대감","비장함, 아껴주는, 환영/호의","비장함, 아껴주는"
3657,「차라리 님이 없이 스스로 님이 되고 살지언정 하늘 위의 직녀성(織女星)은 되지 않겠어요 녜 녜」 나는 언제인지 님의 눈을 쳐다보며 조금 아양스런 소리로 이렇게 말하였습니다,,칠석,한용운,"아껴주는, 비장함, 부끄러움, 환영/호의","아껴주는, 비장함, 부끄러움, 부담/안_내킴, 서러움","부끄러움, 아껴주는","불안/걱정, 비장함"
3658,이 말은 견우(牽牛)의 님을 그리는 직녀(織女)가 일년(一年)에 한번씩 만나는 칠석(七夕)을 어찌 기다리나 하는 동정(同情)의 저주(咀呪)였습니다,,칠석,한용운,"깨달음, 안타까움/실망, 불쌍함/연민","깨달음, 안타까움/실망, 불쌍함/연민, 서러움, 불안/걱정","기대감, 불쌍함/연민, 비장함, 서러움, 슬픔, 존경","깨달음, 슬픔, 안타까움/실망"
3659,이 말에는 나는 모란꽃에 취한 나비처럼 일생(一生)을 님의 키스에 바쁘게 지나겠다는 교만한 맹세(盟誓)가 숨어 있습니다,,칠석,한용운,"아껴주는, 신기함/관심, 존경","기쁨, 부끄러움, 아껴주는, 죄책감, 패배/자기혐오, 흐뭇함(귀여움/예쁨)","기대감, 기쁨, 비장함, 뿌듯함, 아껴주는, 행복","아껴주는, 기대감, 불쌍함/연민, 슬픔"
3660,아아 알 수 없는 것은 운명(運命)이요 지키기 어려운 것은 맹세(盟誓)입니다,,칠석,한용운,"깨달음, 당황/난처, 비장함, 불안/걱정","감동/감탄, 깨달음, 공포/무서움, 불안/걱정, 슬픔, 서러움, 의심/불신","깨달음, 놀람, 부담/안_내킴, 슬픔, 안타까움/실망, 죄책감, 한심함, 짜증, 힘듦/지침","감동/감탄, 깨달음, 기대감, 비장함"
3661,나의 머리가 당신의 팔 위에 도리질을 한 지가 칠석(七夕)을 열 번이나 지나고 또 몇 번을 지내었습니다,,칠석,한용운,"지긋지긋, 불쌍함/연민, 불안/걱정, 불평/불만","불안/걱정, 불평/불만, 서러움, 슬픔, 아껴주는, 안타까움/실망, 힘듦/지침","기대감, 깨달음, 불평/불만, 슬픔, 안타까움/실망","아껴주는, 슬픔, 힘듦/지침"
3662,그러나 그들은 나를 용서하고 불쌍히 여길 뿐이요 무슨 복수적(復讎的) 저주(詛呪)를 아니하였습니다,,칠석,한용운,"슬픔, 불쌍함/연민, 깨달음","슬픔, 불쌍함/연민, 깨달음, 당황/난처, 불평/불만, 불안/걱정, 아껴주는, 안심/신뢰","깨달음, 불쌍함/연민, 서러움, 안타까움/실망, 한심함, 패배/자기혐오","감동/감탄, 부끄러움, 안심/신뢰, 존경"
3663,그들은 밤마다밤마다 은하수(銀河水)를 사이에 두고 마주 건너다보며 이야기하고 놉니다,,칠석,한용운,"즐거움/신남, 흐뭇함(귀여움/예쁨), 아껴주는","즐거움/신남, 흐뭇함(귀여움/예쁨), 아껴주는, 불쌍함/연민, 뿌듯함, 서러움","기대감, 기쁨, 뿌듯함, 아껴주는, 안심/신뢰, 흐뭇함(귀여움/예쁨)","불쌍함/연민, 신기함/관심, 아껴주는, 안타까움/실망, 슬픔"
3664,그들은 헤죽헤죽 웃는 은하수(銀河水)의 강안(江岸)에서 물을 한줌씩 쥐어서 서로 던지고 다시 뉘우쳐 합니다,,칠석,한용운,"흐뭇함(귀여움/예쁨), 아껴주는, 행복","흐뭇함(귀여움/예쁨), 기쁨, 즐거움/신남","감동/감탄, 기대감, 기쁨, 깨달음, 뿌듯함, 아껴주는, 안심/신뢰, 환영/호의, 행복","깨달음, 비장함"
3665,그들은 물에다 발을 잠그고 반비슷이 누어서 서로 안 보는 체하고 무슨 노래를 부릅니다,,칠석,한용운,"신기함/관심, 의심/불신","신기함/관심, 흐뭇함(귀여움/예쁨), 뿌듯함, 아껴주는, 행복","기대감, 아껴주는, 안심/신뢰, 편안/쾌적","불쌍함/연민, 안타까움/실망, 아껴주는, 신기함/관심, 편안/쾌적"
3666,그들은 갈잎으로 배를 만들고 그 배에다 무슨 글을 써서 물에 띄우고 입김으로 불어서 서로 보냅니다 그리고 서로 글을 보고 이해(理解)하지 못하는 것처럼 잠자코 있습니다,,칠석,한용운,"안타까움/실망, 아껴주는, 신기함/관심","안타까움/실망, 아껴주는, 신기함/관심, 서러움, 슬픔, 불쌍함/연민, 불안/걱정","기대감, 신기함/관심, 흐뭇함(귀여움/예쁨)","아껴주는, 안타까움/실망, 힘듦/지침, 불쌍함/연민"
3667,그들은 돌아갈 때에는 서로 보고 웃기만 하고 아무 말도 아니합니다,,칠석,한용운,"불쌍함/연민, 흐뭇함(귀여움/예쁨), 뿌듯함, 아껴주는, 신기함/관심, 안심/신뢰","불쌍함/연민, 흐뭇함(귀여움/예쁨), 뿌듯함, 아껴주는, 안심/신뢰, 서러움, 불안/걱정, 슬픔","고마움, 깨달음, 존경","감동/감탄, 슬픔, 아껴주는, 안타까움/실망, 흐뭇함(귀여움/예쁨)"
3668,지금은 칠월칠석(七月七夕)날 밤입니다,,칠석,한용운,없음,"기대감, 불안/걱정","기대감, 기쁨, 아껴주는, 즐거움/신남","기대감, 기쁨, 신기함/관심, 아껴주는, 행복"
3669,그들은 난초(蘭草)실로 주름을 접은 연꽃(蓮花)의 윗옷을 입었습니다,,칠석,한용운,"흐뭇함(귀여움/예쁨), 아껴주는","흐뭇함(귀여움/예쁨), 감동/감탄, 놀람, 신기함/관심","감동/감탄, 기쁨, 불쌍함/연민, 존경","불쌍함/연민, 슬픔, 안타까움/실망"
3670,그들은 한 구슬에 일곱 빛나는 계수(桂樹)나무 열매의 노리개를 찻습니다,,칠석,한용운,"신기함/관심, 기대감, 없음","신기함/관심, 기대감, 놀람","신기함/관심, 우쭐댐/무시함","기대감, 환영/호의, 기쁨, 편안/쾌적"
3671,키스의 술에 취(醉)할 것을 상상(想像)하는 그들의 뺨은 먼저 기쁨을 못 이기는 자기(自己)의 열정(熱情)에 취(醉)하여 반이나 붉었습니다,,칠석,한용운,"기쁨, 아껴주는, 불안/걱정, 불쌍함/연민, 즐거움/신남, 흐뭇함(귀여움/예쁨), 신기함/관심","기쁨, 아껴주는, 불안/걱정, 즐거움/신남, 흐뭇함(귀여움/예쁨), 신기함/관심, 뿌듯함","기대감, 기쁨, 흐뭇함(귀여움/예쁨), 아껴주는","기쁨, 즐거움/신남, 행복"
3672,그들은 오작교(烏鵲橋)를 건너갈 때에 걸음을 멈추고 윗옷의 뒷자락을 검사(檢査)합니다,,칠석,한용운,"불안/걱정, 의심/불신, 신기함/관심","불안/걱정, 의심/불신, 신기함/관심, 서러움, 짜증","불안/걱정, 의심/불신","불쌍함/연민, 안타까움/실망, 당황/난처"
3673,그들은 오작교(烏鵲橋)를 건너서 서로 포옹(抱擁)하는 동안에 눈물과 웃음이 순서(順序)를 잃더니 다시금 공경(恭敬)하는 얼굴을 보입니다,,칠석,한용운,"존경, 슬픔, 아껴주는, 행복, 기쁨","기쁨, 안심/신뢰, 존경, 아껴주는, 환영/호의, 행복","감동/감탄, 기대감, 기쁨, 아껴주는, 안심/신뢰, 흐뭇함(귀여움/예쁨)","감동/감탄, 뿌듯함, 신기함/관심, 아껴주는, 존경, 행복"
3674,아아 알수 없는 것은 운명(運命)이요 지키기 어려운 것은 맹세(盟誓)입니다,,칠석,한용운,"비장함, 감동/감탄, 불안/걱정, 고마움","감동/감탄, 깨달음, 비장함, 서러움, 안타까움/실망","감동/감탄, 슬픔, 서러움","비장함, 불안/걱정, 안타까움/실망, 슬픔"
3675,나는 그들의 사랑이 표현(表現)인 것을 보았습니다,,칠석,한용운,"안심/신뢰, 깨달음, 흐뭇함(귀여움/예쁨)","기쁨, 뿌듯함, 아껴주는, 흐뭇함(귀여움/예쁨)","기대감, 기쁨, 깨달음, 아껴주는","감동/감탄, 신기함/관심, 아껴주는, 안심/신뢰, 존경, 행복"
3676,진정한 사랑은 표현(表現)할 수가 없습니다,,칠석,한용운,"비장함, 아껴주는, 감동/감탄, 환영/호의","비장함, 아껴주는, 깨달음, 감동/감탄, 행복","감동/감탄, 고마움, 기쁨, 신기함/관심, 아껴주는, 행복","슬픔, 안타까움/실망, 절망, 힘듦/지침"
3677,그들은 나의 사랑을 볼 수는 없습니다,,칠석,한용운,"슬픔, 부끄러움","깨달음, 당황/난처, 불안/걱정, 불평/불만, 서러움, 슬픔, 안타까움/실망, 절망","부담/안_내킴, 불쌍함/연민, 불안/걱정, 서러움, 안타까움/실망","안타까움/실망, 절망, 슬픔, 힘듦/지침"
3678,사랑의 신성(神聖)은 표현에 있지 않고 비밀(秘密)에 있습니다,,칠석,한용운,"깨달음, 존경, 아껴주는, 비장함","깨달음, 존경, 아껴주는, 비장함, 감동/감탄, 기대감, 기쁨, 안심/신뢰","기대감, 깨달음, 비장함, 아껴주는","감동/감탄, 깨달음, 아껴주는, 신기함/관심, 행복"
3679,그들이 나를 하늘로 오라고 손짓을 한대도 나는 가지 않겠습니다,,칠석,한용운,"비장함, 의심/불신, 부담/안_내킴, 당황/난처","부담/안_내킴, 비장함, 슬픔","부담/안_내킴, 비장함, 존경",비장함
3680,오셔요 당신은 오실 때가 되었어요 어서 오셔요,,오셔요,한용운,"기대감, 환영/호의","기대감, 환영/호의, 비장함, 기쁨","환영/호의, 기대감, 아껴주는","기대감, 아껴주는, 행복"
3681,당신은 당신의 오실 때가 언제인지 아십니까 당신의 오실 때는 나의 기다리는 때입니다,,오셔요,한용운,"아껴주는, 환영/호의, 기대감, 깨달음","아껴주는, 환영/호의, 기대감, 깨달음, 비장함, 서러움, 슬픔","기대감, 불쌍함/연민, 불안/걱정, 비장함, 서러움, 아껴주는, 안타까움/실망","기대감, 아껴주는, 신기함/관심, 행복"
3682,당신은 나의 꽃밭에로 오셔요 나의 꽃밭에는 꽃들이 피어 있습니다,,오셔요,한용운,"기대감, 흐뭇함(귀여움/예쁨), 기쁨, 환영/호의","기대감, 기쁨, 환영/호의, 아껴주는, 뿌듯함","기대감, 기쁨, 환영/호의, 흐뭇함(귀여움/예쁨)","기쁨, 아껴주는, 뿌듯함, 흐뭇함(귀여움/예쁨), 환영/호의, 행복"
3683,만일 당신을 쫓아오는 사람이 있으면 당신은 꽃속으로 들어가서 숨으십시요,,오셔요,한용운,"안심/신뢰, 아껴주는, 비장함","불안/걱정, 당황/난처, 비장함, 아껴주는","불안/걱정, 신기함/관심, 아껴주는, 존경, 흐뭇함(귀여움/예쁨)","불안/걱정, 아껴주는"
3684,나는 나비가 되어서 당신 숨은 꽃 위에 가서 앉겠습니다,,오셔요,한용운,"아껴주는, 비장함, 흐뭇함(귀여움/예쁨), 환영/호의","아껴주는, 비장함, 서러움, 슬픔","기대감, 기쁨, 아껴주는, 행복","기대감, 신기함/관심, 아껴주는, 즐거움/신남, 존경"
3685,그러면 쫓아오는 사람이 당신을 찾을 수는 없습니다,,오셔요,한용운,"안타까움/실망, 안심/신뢰","불안/걱정, 비장함","기대감, 안심/신뢰","아껴주는, 기대감, 편안/쾌적, 환영/호의"
3686,오셔요 당신은 오실 때가 되었습니다 어서 오셔요,,오셔요,한용운,"환영/호의, 기대감, 아껴주는","환영/호의, 기대감, 아껴주는, 기쁨, 안심/신뢰","기대감, 기쁨, 아껴주는, 환영/호의","기대감, 아껴주는, 환영/호의, 행복"
3687,당신은 나의 품에로 오셔요 나의 품에는 보드라운 가슴이 있습니다,,오셔요,한용운,"환영/호의, 아껴주는","환영/호의, 뿌듯함, 아껴주는, 편안/쾌적","기대감, 기쁨, 불쌍함/연민, 아껴주는, 안심/신뢰, 행복, 환영/호의","기쁨, 기대감, 환영/호의, 아껴주는, 행복"
3688,만일 당신을 쫓아오는 사람이 있으면 당신은 머리를 숙여서 나의 가슴에 대십시오,,오셔요,한용운,"안심/신뢰, 비장함, 아껴주는, 환영/호의","불쌍함/연민, 불안/걱정, 서러움, 아껴주는, 안심/신뢰, 환영/호의, 비장함","불쌍함/연민, 아껴주는, 존경","불안/걱정, 불쌍함/연민, 아껴주는, 환영/호의"
3689,나의 가슴은 당신이 만질 때에는 물 같이 보드랍지마는 당신의 위험(危險)을 위하여는 황금(黃金)의 칼도 되고 강철(鋼鐵)의 방패도 됩니다,,오셔요,한용운,"존경, 아껴주는, 비장함, 깨달음, 흐뭇함(귀여움/예쁨), 환영/호의","존경, 아껴주는, 비장함","기대감, 비장함","비장함, 아껴주는"
3690,나의 가슴은 말굽에 밟힌 낙화(落花)가 될지언정 당신의 머리가 나의 가슴에서 떨어질 수는 없습니다,,오셔요,한용운,"아껴주는, 비장함, 서러움","아껴주는, 비장함, 서러움, 슬픔","슬픔, 당황/난처","아껴주는, 비장함"
3691,그러면 쫓아오는 사람이 당신에게 손을 댈 수는 없습니다,,오셔요,한용운,"안심/신뢰, 아껴주는","아껴주는, 안심/신뢰, 비장함","불안/걱정, 비장함, 아껴주는, 존경","비장함, 아껴주는, 안심/신뢰"
3692,당신은 나의 죽음 속으로 오셔요 죽음은 당신을 위하여의 준비(準備)가 언제든지 되어 있습니다,,오셔요,한용운,"아껴주는, 비장함, 존경, 안심/신뢰, 환영/호의","아껴주는, 서러움, 슬픔, 공포/무서움, 환영/호의, 존경","당황/난처, 비장함, 아껴주는, 우쭐댐/무시함, 환영/호의","비장함, 환영/호의"
3693,만일 당신을 쫓아오는 사람이 있으면 당신은 나의 죽음의 뒤에 서십시오,,오셔요,한용운,"비장함, 아껴주는, 불안/걱정, 환영/호의","비장함, 아껴주는, 불안/걱정, 서러움, 슬픔","존경, 비장함","비장함, 아껴주는"
3694,죽음은 허무(虛無)와 만능(萬能)이 하나입니다,,오셔요,한용운,"안타까움/실망, 깨달음, 비장함","깨달음, 비장함, 서러움","깨달음, 비장함","깨달음, 절망, 힘듦/지침, 슬픔"
3695,죽음의 사랑은 무한(無限)인 동시(同時)에 무궁(無窮)입니다,,오셔요,한용운,"깨달음, 존경, 비장함, 환영/호의","깨달음, 비장함, 기쁨","감동/감탄, 기대감, 기쁨, 깨달음, 존경","기대감, 비장함, 아껴주는"
3696,죽음의 앞에는 군함(軍艦)과 포대(砲臺)가 티끌이 됩니다,,오셔요,한용운,"비장함, 공포/무서움, 깨달음, 불안/걱정, 패배/자기혐오","공포/무서움, 불안/걱정, 절망","비장함, 안타까움/실망, 힘듦/지침","깨달음, 안타까움/실망, 절망"
3697,그러면 쫓아오는 사람이 당신을 잡을 수는 없습니다,,오셔요,한용운,"아껴주는, 깨달음, 불안/걱정, 불쌍함/연민","아껴주는, 불안/걱정, 불쌍함/연민, 비장함, 서러움","당황/난처, 비장함, 없음",안심/신뢰
3698,"소리 없는 북,",,가슴1,윤동주,"신기함/관심, 없음","신기함/관심, 깨달음, 놀람, 서러움","깨달음, 비장함, 한심함","비장함, 기대감"
3699,답답하면 주먹으로,,가슴1,윤동주,"안타까움/실망, 짜증, 불안/걱정, 불평/불만, 죄책감","안타까움/실망, 짜증, 불평/불만, 우쭐댐/무시함, 지긋지긋, 불안/걱정","부담/안_내킴, 불안/걱정, 짜증, 안타까움/실망, 증오/혐오","비장함, 화남/분노"
3700,뚜다려 보오.,,가슴1,윤동주,"기대감, 불안/걱정","힘듦/지침, 당황/난처, 불안/걱정, 안타까움/실망","신기함/관심, 기대감, 깨달음","힘듦/지침, 불평/불만, 불안/걱정"
3701,그래 봐도,,가슴1,윤동주,"기대감, 우쭐댐/무시함","기대감, 우쭐댐/무시함, 불안/걱정, 부담/안_내킴, 서러움, 안타까움/실망, 한심함",없음,"기대감, 불안/걱정, 안심/신뢰, 신기함/관심"
3702,후—,,가슴1,윤동주,"안심/신뢰, 안타까움/실망","안심/신뢰, 안타까움/실망, 힘듦/지침, 부담/안_내킴, 서러움, 짜증","불쌍함/연민, 불안/걱정",없음
